### ISSUE TITLE
Privacy issue: Browser connects to third party hosts in the background.

### ISSUE THREAD

**Issue by ghost** [brave/browser-laptop#12632]
### Description
Brave browser shows non privacy respecting behavior disregarding user settings.

### Steps to Reproduce

Downloading Brave for the first time, never used before.

1. `wget https://laptop-updates.brave.com/latest/linux64 -O- | tar xj`
2. Turn off any additional network services such as ntpd and similar (to prevent "poluting" the tcpdump monitoring with external data)
3. Reboot and login to Plasma desktop (openSUSE Leap 42.3). Do not start any applications.
4. In a console run:
`# tcpdump -i eth1 -l > /tmp/tcpdump.log & tail -f /tmp/tcpdump.log`

**Actual result:**

Lots of communication not explicitly initiated by the user with hosts like:
```
amazonaws.com
herokudns.com
analytics.brave.com
mercury.basicattentiontoken.org
qwant.com
twitter.com
yandex.com
ocsp.digicert.com
phicdn.net
fastly.net
```

**Expected result:**
No packets should be sent without user initiating that.

**Reproduces how often:**
Always

### Brave Version
```
Brave: 0.19.131 
rev: da2f34787e51eb44190a7a77249e100fb2368306 
Muon: 4.5.36 
libchromiumcontent: 63.0.3239.132 
V8: 6.3.292.49 
Node.js: 7.9.0 
Update Channel: Release 
OS Platform: Linux 
OS Release: 4.4.104-39-default 
OS Architecture: x64
```

### Additional Information

Further testing:

5. Changing settings in an attempt to harden privacy:

* about:preferences#general

Brave starts with: a new tab
A new tab shows: Blank page
My home page is: about:blank
Enable Spell Check: OFF

* about:preferences#search

Search engine: DDG.
Use DuckDuckGo by default for search in Private Tabs: ON

* about:preferences#security

Password Manager: Don't manage my passwords
Enable Autofill: OFF
Autoplay Media: Always deny (was 'Always allow')
Send a 'Do Not Track' header with browsing requests *: ON
Enhance security by loading each site in its own process (experimental) *: ON
Autoplay Media(Clear all): cleared

* about:preferences#extensions

Disable all (PDF Viewer and Torrent Viewer are enabled by default). There are 8 extensions total, none of them seems possible to uninstall.

* about:preferences#shields

Cookie Control: Block all cookies
Block Scripts (will break many sites): ON
Fingerprinting Protection (may break some sites): ON

* about:adblock

All lists are turned off - I leave it this way

* about:preferences#advanced

* Send anonymous crash reports to Brave: OFF

6. Clear all site data, reboot the OS.
7. Start `tcpdump` and run brave:

```
00:11:40.843723 IP pc.47245 > rt.domain: 23770+ A? wpad.domain. (35)
00:11:40.845561 IP rt.domain > pc.47245: 23770 NXDomain 0/0/0 (35)
00:11:40.845657 IP pc.52399 > rt.domain: 1656+ A? wpad. (22)
00:11:40.847184 IP rt.domain > pc.52399: 1656 NXDomain 0/0/0 (22)
00:11:40.847691 IP pc.42484 > rt.domain: 3990+ A? ledger.mercury.basicattentiontoken.org. (56)
00:11:40.908478 IP rt.domain > pc.42484: 3990 9/0/0 CNAME ledger.mercury.basicattentiontoken.org.herokudns.com., A 50.16.212.181, A 50.19.253.166, A 50.17.237.77, A 50.19.217.10, A 50.19.224.119, A 23.23.241.244, A 50.19.99.160, A 54.221.226.80 (250)
00:11:40.908858 IP pc.57566 > ec2-50-16-212-181.compute-1.amazonaws.com.https: Flags [S], seq 1105922361, win 29200, options [mss 1460,sackOK,TS val 4294918269 ecr 0,nop,wscale 7], length 0
00:11:41.033384 IP ec2-50-16-212-181.compute-1.amazonaws.com.https > pc.57566: Flags [S.], seq 3827129980, ack 1105922362, win 26847, options [mss 8961,sackOK,TS val 163537756 ecr 4294918269,nop,wscale 8], length 0
00:11:41.033430 IP pc.57566 > ec2-50-16-212-181.compute-1.amazonaws.com.https: Flags [.], ack 1, win 229, options [nop,nop,TS val 4294918300 ecr 163537756], length 0
00:11:41.033683 IP pc.57566 > ec2-50-16-212-181.compute-1.amazonaws.com.https: Flags [P.], seq 1:227, ack 1, win 229, options [nop,nop,TS val 4294918300 ecr 163537756], length 226
00:11:41.088696 IP pc.39544 > rt.domain: 331+ PTR? 181.212.16.50.in-addr.arpa. (44)
00:11:41.151259 IP rt.domain > pc.39544: 331 1/0/0 PTR ec2-50-16-212-181.compute-1.amazonaws.com. (99)
00:11:41.158143 IP ec2-50-16-212-181.compute-1.amazonaws.com.https > pc.57566: Flags [.], ack 227, win 110, options [nop,nop,TS val 163537787 ecr 4294918300], length 0
00:11:41.166553 IP ec2-50-16-212-181.compute-1.amazonaws.com.https > pc.57566: Flags [P.], seq 1:2978, ack 227, win 110, options [nop,nop,TS val 163537790 ecr 4294918300], length 2977
00:11:41.166587 IP pc.57566 > ec2-50-16-212-181.compute-1.amazonaws.com.https: Flags [.], ack 2978, win 275, options [nop,nop,TS val 4294918333 ecr 163537790], length 0
00:11:41.177788 IP pc.57566 > ec2-50-16-212-181.compute-1.amazonaws.com.https: Flags [P.], seq 227:353, ack 2978, win 275, options [nop,nop,TS val 4294918336 ecr 163537790], length 126
00:11:41.180947 IP pc.57566 > ec2-50-16-212-181.compute-1.amazonaws.com.https: Flags [P.], seq 353:589, ack 2978, win 275, options [nop,nop,TS val 4294918337 ecr 163537790], length 236
00:11:41.303980 IP ec2-50-16-212-181.compute-1.amazonaws.com.https > pc.57566: Flags [P.], seq 2978:3029, ack 353, win 110, options [nop,nop,TS val 163537824 ecr 4294918336], length 51
00:11:41.317334 IP ec2-50-16-212-181.compute-1.amazonaws.com.https > pc.57566: Flags [P.], seq 3029:3450, ack 589, win 114, options [nop,nop,TS val 163537827 ecr 4294918337], length 421
00:11:41.317394 IP pc.57566 > ec2-50-16-212-181.compute-1.amazonaws.com.https: Flags [.], ack 3450, win 298, options [nop,nop,TS val 4294918371 ecr 163537824], length 0
00:11:48.850256 IP pc.54728 > rt.domain: 9701+ A? wpad.domain. (35)
00:11:48.852071 IP rt.domain > pc.54728: 9701 NXDomain 0/0/0 (35)
00:11:48.852167 IP pc.37466 > rt.domain: 36219+ A? wpad. (22)
00:11:48.853667 IP rt.domain > pc.37466: 36219 NXDomain 0/0/0 (22)
```

8. Open settings, watch `tcpdump` output:
```
00:12:26.316237 IP pc.57566 > ec2-50-16-212-181.compute-1.amazonaws.com.https: Flags [.], ack 3450, win 298, options [nop,nop,TS val 4294929621 ecr 163537824], length 0
00:12:26.440476 IP ec2-50-16-212-181.compute-1.amazonaws.com.https > pc.57566: Flags [.], ack 589, win 114, options [nop,nop,TS val 163549108 ecr 4294918371], length 0
00:12:40.865975 IP ec2-50-16-212-181.compute-1.amazonaws.com.https > pc.57566: Flags [F.], seq 3450, ack 589, win 114, options [nop,nop,TS val 163552714 ecr 4294918371], length 0
00:12:40.904238 IP pc.57566 > ec2-50-16-212-181.compute-1.amazonaws.com.https: Flags [.], ack 3451, win 298, options [nop,nop,TS val 4294933268 ecr 163552714], length 0
```

9. Close preferences and start typing in a new tab "https://fsf" suddenly shows in tcpdump:
```
00:13:24.476573 IP pc.57566 > ec2-50-16-212-181.compute-1.amazonaws.com.https: Flags [F.], seq 589, ack 3451, win 298, options [nop,nop,TS val 4294944161 ecr 163552714], length 0
00:13:24.476726 IP pc.39957 > rt.domain: 56242+ A? wpad.domain. (35)
00:13:24.476904 IP pc.35616 > rt.domain: 25980+ A? brave-laptop-updates.global.ssl.fastly.net. (60)
00:13:24.478999 IP rt.domain > pc.39957: 56242 NXDomain 0/0/0 (35)
00:13:24.479077 IP pc.43841 > rt.domain: 10733+ A? wpad. (22)
00:13:24.480584 IP rt.domain > pc.43841: 10733 NXDomain 0/0/0 (22)
00:13:24.528340 IP rt.domain > pc.35616: 25980 5/0/0 CNAME global-ssl.fastly.net., A 151.101.0.249, A 151.101.64.249, A 151.101.128.249, A 151.101.192.249 (149)
00:13:24.528653 IP pc.36772 > 151.101.0.249.https: Flags [S], seq 1499124397, win 29200, options [mss 1460,sackOK,TS val 4294944174 ecr 0,nop,wscale 7], length 0
00:13:24.554841 IP 151.101.0.249.https > pc.36772: Flags [S.], seq 4064073582, ack 1499124398, win 28960, options [mss 1460,sackOK,TS val 198462564 ecr 4294944174,nop,wscale 9], length 0
00:13:24.554880 IP pc.36772 > 151.101.0.249.https: Flags [.], ack 1, win 229, options [nop,nop,TS val 4294944180 ecr 198462564], length 0
00:13:24.555011 IP pc.36772 > 151.101.0.249.https: Flags [P.], seq 1:231, ack 1, win 229, options [nop,nop,TS val 4294944180 ecr 198462564], length 230
00:13:24.580904 IP 151.101.0.249.https > pc.36772: Flags [.], ack 231, win 59, options [nop,nop,TS val 198462571 ecr 4294944180], length 0
00:13:24.582680 IP 151.101.0.249.https > pc.36772: Flags [P.], seq 1:5168, ack 231, win 59, options [nop,nop,TS val 198462571 ecr 4294944180], length 5167
00:13:24.582711 IP pc.36772 > 151.101.0.249.https: Flags [.], ack 5168, win 309, options [nop,nop,TS val 4294944187 ecr 198462571], length 0
00:13:24.583530 IP pc.36772 > 151.101.0.249.https: Flags [P.], seq 231:324, ack 5168, win 309, options [nop,nop,TS val 4294944187 ecr 198462571], length 93
00:13:24.592908 IP pc.36772 > 151.101.0.249.https: Flags [P.], seq 324:632, ack 5168, win 309, options [nop,nop,TS val 4294944190 ecr 198462571], length 308
00:13:24.609687 IP 151.101.0.249.https > pc.36772: Flags [P.], seq 5168:5442, ack 324, win 59, options [nop,nop,TS val 198462578 ecr 4294944187], length 274
00:13:24.648247 IP pc.36772 > 151.101.0.249.https: Flags [.], ack 5442, win 332, options [nop,nop,TS val 4294944204 ecr 198462578], length 0
00:13:24.659476 IP 151.101.0.249.https > pc.36772: Flags [.], ack 632, win 61, options [nop,nop,TS val 198462591 ecr 4294944190], length 0
00:13:24.725507 IP 151.101.0.249.https > pc.36772: Flags [P.], seq 5442:5877, ack 632, win 61, options [nop,nop,TS val 198462607 ecr 4294944204], length 435
00:13:24.725550 IP pc.36772 > 151.101.0.249.https: Flags [.], ack 5877, win 355, options [nop,nop,TS val 4294944223 ecr 198462607], length 0
00:13:24.840242 IP pc.57566 > ec2-50-16-212-181.compute-1.amazonaws.com.https: Flags [F.], seq 589, ack 3451, win 298, options [nop,nop,TS val 4294944252 ecr 163552714], length 0
00:13:25.088519 IP pc.45793 > rt.domain: 51554+ PTR? 249.0.101.151.in-addr.arpa. (44)
00:13:25.090705 IP rt.domain > pc.45793: 51554 NXDomain 0/0/0 (44)
00:13:25.204246 IP pc.57566 > ec2-50-16-212-181.compute-1.amazonaws.com.https: Flags [F.], seq 589, ack 3451, win 298, options [nop,nop,TS val 4294944343 ecr 163552714], length 0
00:13:25.932227 IP pc.57566 > ec2-50-16-212-181.compute-1.amazonaws.com.https: Flags [F.], seq 589, ack 3451, win 298, options [nop,nop,TS val 4294944525 ecr 163552714], length 0
00:13:27.392241 IP pc.57566 > ec2-50-16-212-181.compute-1.amazonaws.com.https: Flags [F.], seq 589, ack 3451, win 298, options [nop,nop,TS val 4294944890 ecr 163552714], length 0
```

10. Finish typing https://fsf.org/robots.txt and press Enter:

```
00:14:34.348059 IP pc.53498 > rt.domain: 44819+ A? fsf.org. (25)
00:14:34.412279 IP rt.domain > pc.53498: 44819 1/0/0 A 208.118.235.174 (41)
00:14:34.412557 IP pc.44234 > www.fsf.org.https: Flags [S], seq 1627756726, win 29200, options [mss 1460,sackOK,TS val 4294961645 ecr 0,nop,wscale 7], length 0
00:14:34.534221 IP www.fsf.org.https > pc.44234: Flags [S.], seq 3759678098, ack 1627756727, win 14480, options [mss 1394,sackOK,TS val 3367780211 ecr 4294961645,nop,wscale 6], length 0
00:14:34.534266 IP pc.44234 > www.fsf.org.https: Flags [.], ack 1, win 229, options [nop,nop,TS val 4294961675 ecr 3367780211], length 0
00:14:34.534400 IP pc.44234 > www.fsf.org.https: Flags [P.], seq 1:196, ack 1, win 229, options [nop,nop,TS val 4294961675 ecr 3367780211], length 195
00:14:34.654445 IP www.fsf.org.https > pc.44234: Flags [.], ack 196, win 243, options [nop,nop,TS val 3367780242 ecr 4294961675], length 0
00:14:34.655084 IP www.fsf.org.https > pc.44234: Flags [P.], seq 1:4097, ack 196, win 243, options [nop,nop,TS val 3367780242 ecr 4294961675], length 4096
00:14:34.655120 IP pc.44234 > www.fsf.org.https: Flags [.], ack 4097, win 293, options [nop,nop,TS val 4294961705 ecr 3367780242], length 0
00:14:34.655124 IP www.fsf.org.https > pc.44234: Flags [P.], seq 4097:4275, ack 196, win 243, options [nop,nop,TS val 3367780242 ecr 4294961675], length 178
00:14:34.655134 IP pc.44234 > www.fsf.org.https: Flags [.], ack 4275, win 315, options [nop,nop,TS val 4294961705 ecr 3367780242], length 0
00:14:34.655909 IP pc.44234 > www.fsf.org.https: Flags [P.], seq 196:514, ack 4275, win 315, options [nop,nop,TS val 4294961705 ecr 3367780242], length 318
00:14:34.783435 IP www.fsf.org.https > pc.44234: Flags [P.], seq 4275:4501, ack 514, win 260, options [nop,nop,TS val 3367780274 ecr 4294961705], length 226
00:14:34.788160 IP pc.44234 > www.fsf.org.https: Flags [P.], seq 514:922, ack 4501, win 338, options [nop,nop,TS val 4294961738 ecr 3367780274], length 408
00:14:34.909611 IP www.fsf.org.https > pc.44234: Flags [P.], seq 4501:5030, ack 922, win 277, options [nop,nop,TS val 3367780305 ecr 4294961738], length 529
00:14:34.914797 IP pc.52074 > rt.domain: 43089+ A? www.fsf.org. (29)
00:14:34.948249 IP pc.44234 > www.fsf.org.https: Flags [.], ack 5030, win 360, options [nop,nop,TS val 4294961779 ecr 3367780305], length 0
00:14:34.964143 IP rt.domain > pc.52074: 43089 1/0/0 A 208.118.235.174 (45)
00:14:34.964408 IP pc.44236 > www.fsf.org.https: Flags [S], seq 398398916, win 29200, options [mss 1460,sackOK,TS val 4294961783 ecr 0,nop,wscale 7], length 0
00:14:35.086034 IP www.fsf.org.https > pc.44236: Flags [S.], seq 499273268, ack 398398917, win 14480, options [mss 1394,sackOK,TS val 3367780350 ecr 4294961783,nop,wscale 6], length 0
00:14:35.086078 IP pc.44236 > www.fsf.org.https: Flags [.], ack 1, win 229, options [nop,nop,TS val 4294961813 ecr 3367780350], length 0
00:14:35.086201 IP pc.44236 > www.fsf.org.https: Flags [P.], seq 1:200, ack 1, win 229, options [nop,nop,TS val 4294961813 ecr 3367780350], length 199
00:14:35.088553 IP pc.35534 > rt.domain: 16321+ PTR? 174.235.118.208.in-addr.arpa. (46)
00:14:35.207506 IP www.fsf.org.https > pc.44236: Flags [.], ack 200, win 243, options [nop,nop,TS val 3367780380 ecr 4294961813], length 0
00:14:35.208217 IP www.fsf.org.https > pc.44236: Flags [P.], seq 1:4097, ack 200, win 243, options [nop,nop,TS val 3367780380 ecr 4294961813], length 4096
00:14:35.208256 IP pc.44236 > www.fsf.org.https: Flags [.], ack 4097, win 293, options [nop,nop,TS val 4294961844 ecr 3367780380], length 0
00:14:35.208261 IP www.fsf.org.https > pc.44236: Flags [P.], seq 4097:4275, ack 200, win 243, options [nop,nop,TS val 3367780380 ecr 4294961813], length 178
00:14:35.208269 IP pc.44236 > www.fsf.org.https: Flags [.], ack 4275, win 315, options [nop,nop,TS val 4294961844 ecr 3367780380], length 0
00:14:35.208863 IP pc.44236 > www.fsf.org.https: Flags [P.], seq 200:518, ack 4275, win 315, options [nop,nop,TS val 4294961844 ecr 3367780380], length 318
00:14:35.241777 IP rt.domain > pc.35534: 16321 1/0/1 PTR www.fsf.org. (87)
00:14:35.337363 IP www.fsf.org.https > pc.44236: Flags [P.], seq 4275:4517, ack 518, win 260, options [nop,nop,TS val 3367780412 ecr 4294961844], length 242
00:14:35.338304 IP pc.44236 > www.fsf.org.https: Flags [P.], seq 518:930, ack 4517, win 338, options [nop,nop,TS val 4294961876 ecr 3367780412], length 412
00:14:35.460253 IP www.fsf.org.https > pc.44236: Flags [P.], seq 4517:4998, ack 930, win 277, options [nop,nop,TS val 3367780443 ecr 4294961876], length 481
00:14:35.500237 IP pc.44236 > www.fsf.org.https: Flags [.], ack 4998, win 360, options [nop,nop,TS val 4294961917 ecr 3367780443], length 0
00:14:35.569996 IP pc.59000 > rt.domain: 26918+ A? wpad.domain. (35)
00:14:35.571654 IP rt.domain > pc.59000: 26918 NXDomain 0/0/0 (35)
00:14:35.571748 IP pc.37505 > rt.domain: 4294+ A? wpad. (22)
00:14:35.573259 IP rt.domain > pc.37505: 4294 NXDomain 0/0/0 (22)
00:14:35.573570 IP pc.44238 > www.fsf.org.https: Flags [S], seq 1132551166, win 29200, options [mss 1460,sackOK,TS val 4294961935 ecr 0,nop,wscale 7], length 0
00:14:35.699278 IP www.fsf.org.https > pc.44238: Flags [S.], seq 3200088607, ack 1132551167, win 14480, options [mss 1394,sackOK,TS val 3367780503 ecr 4294961935,nop,wscale 6], length 0
00:14:35.699333 IP pc.44238 > www.fsf.org.https: Flags [.], ack 1, win 229, options [nop,nop,TS val 4294961966 ecr 3367780503], length 0
00:14:35.699430 IP pc.44238 > www.fsf.org.https: Flags [P.], seq 1:200, ack 1, win 229, options [nop,nop,TS val 4294961966 ecr 3367780503], length 199
00:14:35.824747 IP www.fsf.org.https > pc.44238: Flags [.], ack 200, win 243, options [nop,nop,TS val 3367780534 ecr 4294961966], length 0
00:14:35.825486 IP www.fsf.org.https > pc.44238: Flags [P.], seq 1:4097, ack 200, win 243, options [nop,nop,TS val 3367780534 ecr 4294961966], length 4096
00:14:35.825520 IP pc.44238 > www.fsf.org.https: Flags [.], ack 4097, win 293, options [nop,nop,TS val 4294961998 ecr 3367780534], length 0
00:14:35.825524 IP www.fsf.org.https > pc.44238: Flags [P.], seq 4097:4275, ack 200, win 243, options [nop,nop,TS val 3367780534 ecr 4294961966], length 178
00:14:35.825530 IP pc.44238 > www.fsf.org.https: Flags [.], ack 4275, win 315, options [nop,nop,TS val 4294961998 ecr 3367780534], length 0
00:14:35.826000 IP pc.44238 > www.fsf.org.https: Flags [P.], seq 200:518, ack 4275, win 315, options [nop,nop,TS val 4294961998 ecr 3367780534], length 318
00:14:35.962466 IP www.fsf.org.https > pc.44238: Flags [P.], seq 4275:4517, ack 518, win 260, options [nop,nop,TS val 3367780568 ecr 4294961998], length 242
00:14:35.963120 IP pc.44238 > www.fsf.org.https: Flags [P.], seq 518:847, ack 4517, win 338, options [nop,nop,TS val 4294962032 ecr 3367780568], length 329
00:14:36.090326 IP www.fsf.org.https > pc.44238: Flags [P.], seq 4517:5060, ack 847, win 277, options [nop,nop,TS val 3367780601 ecr 4294962032], length 543
00:14:36.095095 IP pc.44856 > rt.domain: 8633+ A? static.fsf.org. (32)
00:14:36.128256 IP pc.44238 > www.fsf.org.https: Flags [.], ack 5060, win 360, options [nop,nop,TS val 4294962074 ecr 3367780601], length 0
00:14:36.158069 IP rt.domain > pc.44856: 8633 2/0/0 CNAME svnweb.fsf.org., A 208.118.235.30 (69)
00:14:36.158314 IP pc.59762 > svnweb.fsf.org.http: Flags [S], seq 2281056459, win 29200, options [mss 1460,sackOK,TS val 4294962081 ecr 0,nop,wscale 7], length 0
00:14:36.278542 IP svnweb.fsf.org.http > pc.59762: Flags [S.], seq 1121788327, ack 2281056460, win 5792, options [mss 1394,sackOK,TS val 3504741561 ecr 4294962081,nop,wscale 7], length 0
00:14:36.278583 IP pc.59762 > svnweb.fsf.org.http: Flags [.], ack 1, win 229, options [nop,nop,TS val 4294962111 ecr 3504741561], length 0
00:14:36.278684 IP pc.59762 > svnweb.fsf.org.http: Flags [P.], seq 1:311, ack 1, win 229, options [nop,nop,TS val 4294962111 ecr 3504741561], length 310: HTTP: GET /fsforg/img/favicon.ico HTTP/1.1
00:14:36.398594 IP svnweb.fsf.org.http > pc.59762: Flags [.], ack 311, win 54, options [nop,nop,TS val 3504741591 ecr 4294962111], length 0
00:14:36.400030 IP svnweb.fsf.org.http > pc.59762: Flags [P.], seq 1:854, ack 311, win 54, options [nop,nop,TS val 3504741592 ecr 4294962111], length 853: HTTP: HTTP/1.1 200 OK
00:14:36.400059 IP pc.59762 > svnweb.fsf.org.http: Flags [.], ack 854, win 242, options [nop,nop,TS val 4294962141 ecr 3504741592], length 0
00:14:37.088579 IP pc.33390 > rt.domain: 60315+ PTR? 30.235.118.208.in-addr.arpa. (45)
00:14:39.403283 IP svnweb.fsf.org.http > pc.59762: Flags [F.], seq 854, ack 311, win 54, options [nop,nop,TS val 3504742343 ecr 4294962141], length 0
00:14:39.440231 IP pc.59762 > svnweb.fsf.org.http: Flags [.], ack 855, win 242, options [nop,nop,TS val 4294962902 ecr 3504742343], length 0
00:14:41.087712 IP rt.domain > pc.33390: 60315 1/0/1 PTR svnweb.fsf.org. (89)
00:14:43.575453 IP pc.36647 > rt.domain: 33386+ A? wpad.domain. (35)
00:14:43.577133 IP rt.domain > pc.36647: 33386 NXDomain 0/0/0 (35)
00:14:43.577209 IP pc.38009 > rt.domain: 28290+ A? wpad. (22)
00:14:43.578695 IP rt.domain > pc.38009: 28290 NXDomain 0/0/0 (22)
```

11. Close browser:
```
00:15:58.352479 IP pc.59762 > svnweb.fsf.org.http: Flags [F.], seq 311, ack 855, win 242, options [nop,nop,TS val 15334 ecr 3504753624], length 0
00:15:58.352490 IP pc.44238 > www.fsf.org.https: Flags [F.], seq 847, ack 5060, win 360, options [nop,nop,TS val 15334 ecr 3367791882], length 0
00:15:58.352503 IP pc.44236 > www.fsf.org.https: Flags [F.], seq 930, ack 4998, win 360, options [nop,nop,TS val 15334 ecr 3367791724], length 0
00:15:58.352507 IP pc.44234 > www.fsf.org.https: Flags [F.], seq 922, ack 5030, win 360, options [nop,nop,TS val 15334 ecr 3367791586], length 0
00:15:58.352511 IP pc.36772 > 151.101.0.249.https: Flags [F.], seq 632, ack 5877, win 355, options [nop,nop,TS val 15334 ecr 198496406], length 0
00:15:58.378026 IP 151.101.0.249.https > pc.36772: Flags [P.], seq 5877:5908, ack 633, win 61, options [nop,nop,TS val 198501020 ecr 15334], length 31
00:15:58.378062 IP pc.36772 > 151.101.0.249.https: Flags [R], seq 1499125030, win 0, length 0
00:15:58.378066 IP 151.101.0.249.https > pc.36772: Flags [F.], seq 5908, ack 633, win 61, options [nop,nop,TS val 198501020 ecr 15334], length 0
00:15:58.378071 IP pc.36772 > 151.101.0.249.https: Flags [R], seq 1499125030, win 0, length 0
00:15:58.472419 IP svnweb.fsf.org.http > pc.59762: Flags [R], seq 1121789182, win 0, length 0
00:15:58.472813 IP www.fsf.org.https > pc.44234: Flags [P.], seq 5030:5061, ack 923, win 277, options [nop,nop,TS val 3367801197 ecr 15334], length 31
00:15:58.472857 IP pc.44234 > www.fsf.org.https: Flags [R], seq 1627757649, win 0, length 0
00:15:58.472860 IP www.fsf.org.https > pc.44234: Flags [F.], seq 5061, ack 923, win 277, options [nop,nop,TS val 3367801197 ecr 15334], length 0
00:15:58.472867 IP pc.44234 > www.fsf.org.https: Flags [R], seq 1627757649, win 0, length 0
00:15:58.474144 IP www.fsf.org.https > pc.44236: Flags [P.], seq 4998:5029, ack 931, win 277, options [nop,nop,TS val 3367801198 ecr 15334], length 31
00:15:58.474162 IP pc.44236 > www.fsf.org.https: Flags [R], seq 398399847, win 0, length 0
00:15:58.474216 IP www.fsf.org.https > pc.44236: Flags [F.], seq 5029, ack 931, win 277, options [nop,nop,TS val 3367801198 ecr 15334], length 0
00:15:58.474228 IP pc.44236 > www.fsf.org.https: Flags [R], seq 398399847, win 0, length 0
00:15:58.477957 IP www.fsf.org.https > pc.44238: Flags [P.], seq 5060:5091, ack 848, win 277, options [nop,nop,TS val 3367801199 ecr 15334], length 31
00:15:58.477978 IP pc.44238 > www.fsf.org.https: Flags [R], seq 1132552014, win 0, length 0
00:15:58.478109 IP www.fsf.org.https > pc.44238: Flags [F.], seq 5091, ack 848, win 277, options [nop,nop,TS val 3367801199 ecr 15334], length 0
00:15:58.478123 IP pc.44238 > www.fsf.org.https: Flags [R], seq 1132552014, win 0, length 0
```
12. After brave process has died still some random requests to amazonaws and to other strange hosts (151.101.0.249, movistar.cl) continue.

**Expected**
No communication with any host. Even without all the "strengthening" explained above - full privacy should be there by default. No remote host should ever be contacted without the user explicitly initiating that connection.

**Actual**
`tcpdump` always shows some "chattering" with other hosts. Even when explicitly requesting a remote text file, the program connects to other parties.

**Comment by Liunkae** [comment]
Communication can be caused by a visit to the Preferences search page (about:preferences#search). Since favicons are not cached (#2697), they are retrieved when that page is first visited. Same goes for bookmark bar items. This explains some of the hosts (Twitter, Qwant, Yandex), but not all.

**Comment by Liunkae** [comment]
Some of the other hosts (amazonaws.com, analytics.brave.com, mercury.basicattentiontoken.org) are contacted on first launch when accessing about:welcome.

By the way, I agree with you that this is a privacy issue.

**Comment by bsclifton** [comment]
cc: @flamsmark

**Comment by flamsmark** [comment]
Thank you so much for auditing this for us! 

We should make sure that the Brave infrastructure hosts we access automatically have descriptive hostnames at <brave.com> rather than Fastly or indecipherable EC2 hostnames. The brave infrastructure we access should only be what's needed for Brave to run safely and smoothly. We certainly shouldn't be making unexpected requests to third parties without user interaction.

**Comment by t33rex** [comment]
> We certainly shouldn't be making unexpected requests to third parties without user interaction.
brave.com is still a 3rd party considering that 1st party is the user and 2nd party is the website s/he types to visit. So in a truly privacy respecting program there should not such connections whatsoever without prior consent of the user. The program must be able to work properly without they user "paying" for this with his privacy.

**Comment by flamsmark** [comment]
There are plenty of core Brave features — like updating our block lists, add-ons, or the browser itself — which are non-interactive but require network connections. We try to keep these to a minimum, and are working on other tools like Tor integration to further minimize the tradeoffs involved with providing a safe and reliable browser. We ship Brave with a combination of features which we think makes the most sense for most users. Naturally, you can turn these features off and stop these connections from going out, just like you can turn on other features like Brave Payments or a password manager which make other connections. Most people never change the defaults, and it's important to us that the browser starts out in a state where it works well and keeps people safe.

**Comment by t33rex** [comment]
I am not looking for an argument. There can be no safety without privacy in 2018. If any service connections aim to improve safety, they should all be 1) turned off by default 2) approved by the user after careful explanation 3) anonymized.

Today it is not safe even to have a browser with JavaScript enabled (Spectre, Meltdown).

**Comment by t33rex** [comment]
> Naturally, you can turn these features off and stop these connections from going out,

Have I not already done this in the described STR?
